{
  "schemaVersion": "staatus.public.v1",
  "generatedAt": "2026-07-11T11:58:01Z",
  "active": [
    {
      "id": "inc-2026-07-10-webhooks-delay",
      "title": "Webhook delivery delays",
      "status": "monitoring",
      "impact": "degraded",
      "components": [
        "webhooks"
      ],
      "started_at": "2026-07-10T10:20:00Z",
      "summary": "Webhook deliveries are recovering after a queue backlog caused elevated delivery latency.",
      "updates": [
        {
          "status": "investigating",
          "body": "We are investigating increased delivery latency for outbound webhooks.",
          "created_at": "2026-07-10T10:20:00Z"
        },
        {
          "status": "identified",
          "body": "A worker pool fell behind after a burst of retry traffic. Extra capacity is online.",
          "created_at": "2026-07-10T10:42:00Z"
        },
        {
          "status": "monitoring",
          "body": "Delivery latency is trending down and queued events are draining normally.",
          "created_at": "2026-07-10T11:08:00Z"
        }
      ],
      "StartedTime": "2026-07-10T10:20:00Z"
    }
  ],
  "recent": [
    {
      "id": "inc-2026-07-10-webhooks-delay",
      "title": "Webhook delivery delays",
      "status": "monitoring",
      "impact": "degraded",
      "components": [
        "webhooks"
      ],
      "started_at": "2026-07-10T10:20:00Z",
      "summary": "Webhook deliveries are recovering after a queue backlog caused elevated delivery latency.",
      "updates": [
        {
          "status": "investigating",
          "body": "We are investigating increased delivery latency for outbound webhooks.",
          "created_at": "2026-07-10T10:20:00Z"
        },
        {
          "status": "identified",
          "body": "A worker pool fell behind after a burst of retry traffic. Extra capacity is online.",
          "created_at": "2026-07-10T10:42:00Z"
        },
        {
          "status": "monitoring",
          "body": "Delivery latency is trending down and queued events are draining normally.",
          "created_at": "2026-07-10T11:08:00Z"
        }
      ],
      "StartedTime": "2026-07-10T10:20:00Z"
    },
    {
      "id": "inc-2026-07-02-dashboard-errors",
      "title": "Dashboard sign-in errors",
      "status": "resolved",
      "impact": "minor",
      "components": [
        "dashboard"
      ],
      "started_at": "2026-07-02T15:04:00Z",
      "resolved_at": "2026-07-02T15:39:00Z",
      "summary": "A bad cache key caused intermittent dashboard sign-in failures for a subset of users.",
      "updates": [
        {
          "status": "investigating",
          "body": "We are investigating reports of intermittent dashboard sign-in failures.",
          "created_at": "2026-07-02T15:04:00Z"
        },
        {
          "status": "resolved",
          "body": "The cache key issue has been corrected and sign-ins are back to normal.",
          "created_at": "2026-07-02T15:39:00Z"
        }
      ],
      "StartedTime": "2026-07-02T15:04:00Z"
    }
  ]
}
